{
  "id": "poison:example",
  "name": "example name",
  "simple_name": "example",
  "poison_type": "contact",
  "source": "example source",
  "page": 1,
  "aliases": [
    "example aliases"
  ],
  "type": "example type",
  "description": "example description",
  "save": {
    "ability": "strength",
    "dc": 1
  },
  "damage": {
    "dice": "example dice",
    "type": "example type",
    "type_id": "damage:example",
    "on_save": "example on_save"
  },
  "condition": "example condition",
  "duration": "example duration",
  "cost": {
    "amount": 0,
    "currency": "cp"
  },
  "source_table": "example source_table",
  "row_index": 0,
  "_meta": {}
}
